front,back,tags
"What is photosynthesis?","The process by which green plants use sunlight to synthesize nutrients from carbon dioxide and water, producing oxygen as a byproduct.","biology science"
"What is the Pythagorean theorem?","a² + b² = c² — In a right triangle, the square of the hypotenuse equals the sum of squares of the other two sides.","math geometry"
"What does HTTP stand for?","HyperText Transfer Protocol","tech networking"
"Who wrote '1984'?","George Orwell","literature"
"What is the speed of light?","Approximately 299,792,458 meters per second (3 × 10⁸ m/s)","physics science"
